{"schemaVersion":"1.0.0","id":"core:example:tabs-basic-react","kind":"example","name":"Basic React Tabs","summary":"The minimum React Tabs example.","lifecycle":"experimental","binding":{"ref":"core:component:tabs#web.react","guidanceImpact":"normative","purposes":["generation","explanation","validation"],"preference":0},"complexity":"minimal","prerequisites":[],"source":"catalog/components/tabs/examples/react/basic.tsx"}
