{"schemaVersion":"1.0.0","id":"core:example:color-swatch-basic-react","kind":"example","name":"Basic React ColorSwatch","summary":"The minimum React ColorSwatch example.","lifecycle":"experimental","binding":{"ref":"core:component:color-swatch#web.react","guidanceImpact":"normative","purposes":["generation","explanation","validation"],"preference":0},"complexity":"minimal","prerequisites":[],"source":"catalog/components/color-swatch/examples/react/basic.tsx"}
