{"schemaVersion":"1.0.0","id":"muxui:example:toggle-button-group-basic-react","kind":"example","name":"Basic React ToggleButtonGroup","summary":"The minimum React ToggleButtonGroup example.","lifecycle":"experimental","binding":{"ref":"muxui:component:toggle-button-group#web.react","guidanceImpact":"normative","purposes":["generation","explanation","validation"],"preference":0},"complexity":"minimal","prerequisites":[],"source":"catalog/components/toggle-button-group/examples/react/basic.tsx"}
