{"schemaVersion":"1.0.0","id":"core:example:autocomplete-basic-react","kind":"example","name":"Basic React Autocomplete","summary":"The minimum React Autocomplete example.","lifecycle":"experimental","binding":{"ref":"core:component:autocomplete#web.react","guidanceImpact":"normative","purposes":["generation","explanation","validation"],"preference":0},"complexity":"minimal","prerequisites":[],"source":"catalog/components/autocomplete/examples/react/basic.tsx"}
