{"schemaVersion":"1.0.0","id":"core:example:color-picker-basic-react","kind":"example","name":"Basic React ColorPicker","summary":"The minimum React ColorPicker example.","lifecycle":"experimental","binding":{"ref":"core:component:color-picker#web.react","guidanceImpact":"normative","purposes":["generation","explanation","validation"],"preference":0},"complexity":"minimal","prerequisites":[],"source":"catalog/components/color-picker/examples/react/basic.tsx"}
