{"schemaVersion":"1.0.0","id":"core:example:form-basic-react","kind":"example","name":"Basic React Form","summary":"The minimum React Form example.","lifecycle":"experimental","binding":{"ref":"core:component:form#web.react","guidanceImpact":"normative","purposes":["generation","explanation","validation"],"preference":0},"complexity":"minimal","prerequisites":[],"source":"catalog/components/form/examples/react/basic.tsx"}
