{"schemaVersion":"1.0.0","id":"core:example:toast-basic-react","kind":"example","name":"Basic React Toast","summary":"The minimum React Toast example.","lifecycle":"experimental","binding":{"ref":"core:component:toast#web.react","guidanceImpact":"normative","purposes":["generation","explanation","validation"],"preference":0},"complexity":"minimal","prerequisites":[],"source":"catalog/components/toast/examples/react/basic.tsx"}
