{"schemaVersion":"1.0.0","id":"core:example:menu-basic-react","kind":"example","name":"Basic React Menu","summary":"The minimum React Menu example.","lifecycle":"experimental","binding":{"ref":"core:component:menu#web.react","guidanceImpact":"normative","purposes":["generation","explanation","validation"],"preference":0},"complexity":"minimal","prerequisites":[],"source":"catalog/components/menu/examples/react/basic.tsx"}
