{"schemaVersion":"1.0.0","id":"muxui:example:number-field-basic-react","kind":"example","name":"Basic React NumberField","summary":"The minimum React NumberField example.","lifecycle":"experimental","binding":{"ref":"muxui:component:number-field#web.react","guidanceImpact":"normative","purposes":["generation","explanation","validation"],"preference":0},"complexity":"minimal","prerequisites":[],"source":"catalog/components/number-field/examples/react/basic.tsx"}
