{"schemaVersion":"1.0.0","id":"core:example:date-range-picker-basic-react","kind":"example","name":"Basic React DateRangePicker","summary":"The minimum React DateRangePicker example.","lifecycle":"experimental","binding":{"ref":"core:component:date-range-picker#web.react","guidanceImpact":"normative","purposes":["generation","explanation","validation"],"preference":0},"complexity":"minimal","prerequisites":[],"source":"catalog/components/date-range-picker/examples/react/basic.tsx"}
