{"schemaVersion":"1.0.0","id":"core:example:color-swatch-picker-basic-react","kind":"example","name":"Basic React ColorSwatchPicker","summary":"The minimum React ColorSwatchPicker example.","lifecycle":"experimental","binding":{"ref":"core:component:color-swatch-picker#web.react","guidanceImpact":"normative","purposes":["generation","explanation","validation"],"preference":0},"complexity":"minimal","prerequisites":[],"source":"catalog/components/color-swatch-picker/examples/react/basic.tsx"}
